{
  "$schema": "https://json-schema.org/draft/2020-12/schema",
  "$id": "https://cowboy.stormbird.xyz/schemas/call-profile-v1.json",
  "title": "Cowboy managed-call profile",
  "description": "Purposes and agent-facing guidance for Cowboy managed agent calls. Grants, snapshots and the read-only sandbox remain core.",
  "type": "object",
  "additionalProperties": false,
  "required": [
    "schema_version",
    "id",
    "version",
    "display_name",
    "description",
    "supported_platforms",
    "purposes",
    "guidance"
  ],
  "properties": {
    "schema_version": {
      "const": 1
    },
    "id": {
      "type": "string",
      "pattern": "^[a-z0-9]+(?:-[a-z0-9]+)*$"
    },
    "version": {
      "type": "string",
      "pattern": "^(0|[1-9][0-9]*)\\.(0|[1-9][0-9]*)\\.(0|[1-9][0-9]*)$"
    },
    "display_name": {
      "type": "string",
      "minLength": 1,
      "maxLength": 128,
      "pattern": "^[^\\x00-\\x1f\\x7f]*\\S[^\\x00-\\x1f\\x7f]*$"
    },
    "description": {
      "type": "string",
      "minLength": 1,
      "maxLength": 512,
      "pattern": "^[^\\x00-\\x1f\\x7f]*\\S[^\\x00-\\x1f\\x7f]*$"
    },
    "supported_platforms": {
      "type": "array",
      "minItems": 1,
      "maxItems": 4,
      "uniqueItems": true,
      "items": {
        "type": "object",
        "additionalProperties": false,
        "required": [
          "os",
          "architecture"
        ],
        "properties": {
          "os": {
            "enum": [
              "linux",
              "macos"
            ]
          },
          "architecture": {
            "enum": [
              "x86_64",
              "aarch64"
            ]
          }
        }
      }
    },
    "purposes": {
      "type": "array",
      "minItems": 1,
      "maxItems": 16,
      "items": {
        "type": "object",
        "additionalProperties": false,
        "required": [
          "id",
          "label"
        ],
        "properties": {
          "id": {
            "enum": ["review", "design_review", "analysis"]
          },
          "label": {
            "type": "string",
            "minLength": 1,
            "maxLength": 64,
            "pattern": "^[^\\x00-\\x1f\\x7f]*\\S[^\\x00-\\x1f\\x7f]*$"
          }
        }
      }
    },
    "guidance": {
      "type": "string",
      "minLength": 1,
      "maxLength": 4096
    }
  }
}
